outputs/analysis/dsst_by_burden.csv

"burden_group","CFDDS","se","ci_l","ci_u"
"0",58.6320150946167,1.46753434808933,55.7557006262861,61.5083295629472
"1",54.4607038844096,0.902223770569949,52.6923777880965,56.2290299807226
"2",51.9228658014363,0.876704840046182,50.2045558898738,53.6411757129988
"3",50.3332542131368,1.10325328887108,48.1709175011241,52.4955909251495
"4",47.0592916657389,1.39058117995264,44.3338026354525,49.7847806960253

README.md

### Cognitive Performance by Cardiometabolic Burden

The overall survey-weighted mean DSST score was 52.32 points (SE 0.56) (Table 1). Cognitive performance measured by DSST score decreased with increasing cardiometabolic burden (Figure 1). Participants with zero risk factors had a mean DSST score of 58.63 points (SE 1.47), those with one risk factor had a mean DSST score of 54.45 (SE 0.90), those with two had a mean DSST score of 51.92 (SE 0.88), those with three had a mean DSST score of 50.33 (SE 1.10), and those with four cardiometabolic risk factors had a mean DSST score of 47.06 (SE 1.39) (Figure 1). The difference between the unadjusted weighted means for participants with zero and four risk factors was 11.57 DSST points.